{
	"$schema": "../../../docs/schemas/admin-v1.json",
	"name": "minimal-v1",
	"title": "Minimal v1 fixture",
	"version": 1,
	"settings": {
		"shell": { "layoutEngine": "core:site-editor-layout" },
		"applications": [
			{
				"id": "posts",
				"source": "core:posts",
				"title": "Posts",
				"route": "/posts"
			}
		],
		"defaultRoute": "/posts"
	}
}
